"도서명";"책표지";"글쓴이";"도서번호";"출판사";"출판일";"도서상태";"도서갯수";"대출여부";"대출일";"반납일";"도서가격";"페이지";"줄거리";"메모"
"대한민국 트레킹 가이드";"";"진우석, 이상은";900550;"중앙북스";"2021.11.02";"이상없음";0;"대출 가능";0;"";19800;596;"";"25년이 넘도록 국내외 아름다운 길을 찾아다닌 여행전문작가와 산악전문가가 만나 국내 트레킹 여행에 대한 모든 것을 총망라한 책이다. 오랜 기간 수집한 여행 정보를 종합해 꼭 가봐야 할 국내 트레킹 코스 66곳을 엄선했다. 아주 오래전부터 사랑을 받아온 클래식 코스부터 최근 개발된 코스까지 여행자의 취향에 따라 골라 찾아갈 수 있도록 계절별, 테마별, 난이도별, 지역별로 구분해 소개한다."
"최강의 단식";"";"데이브 아스프리";908854;"북라이프";"2021.11.30";"이상없음";0;"대출 가능";0;"";17550;404;"";"단 몇 끼를 굶었을 뿐인데 넘치는 활력을 회복하고 성공의 지름길이 펼쳐진다!
방탄커피 창시자로 전 세계 다이어트 개념을 바꿔버린 데이브 아스프리가 정립한
세상에서 가장 정확하고 완벽한 단식 안내서"
"비전공자를 위한 이해할 수 있는 IT지식";"";"최원영";913852;"티더블유아이지";"2020.07.14";"이상없음";0;"대출 가능";0;"";15120;240;"";"우리는 매일 스마트폰으로 메시지를 보내고, 컴퓨터로 일을 합니다. 또 음식점에서 키오스크로 주문하고, 가상현실에서 게임을 즐깁니다. IT는 더 이상 전문가들만의 이야기가 아닙니다. 우리의 삶 곳곳을 IT가 점령하고 있고, 그 속도는 계속해서 빨라지고 있습니다. 이제 IT를 모르고선 세상을 이해하기 어려운 시대가 되었습니다."
"패턴 인식";"";"오일석";927845;"교보문고";"2008.08.20";"이상없음";0;"대출 가능";0;"";25000;496;"";"특징 추출과 선택도 상세히 다루고 있고, 군집화 알고리즘도 체계적으로 제시하고 있다. 배깅과 Adaboost같은 혼성 모델도 다루며, 시뮬레이티드 어닐링과 유전 알고리즘이 패턴 인식에 어떻게 활용되는 지도 자세히 설명한다. 모든 알고리즘은 상세한 의사 코드로 작성되어 구현을 도와 준다. 부록은 OSS를 포함하여 다양한 정보를 인터넷에서 쉽게 찾을 수 있도록 나침반 역할을 한다."
"혼자 공부하는 파이썬";"";"윤인성";941875;"한빛미디어";"2019.06.10";"이상없음";0;"대출 가능";0;"";16200;460;"";"‘무엇을’, ‘어떻게’ 학습해야 할지조차 모르는 입문자의 막연한 마음을 살펴, 과외 선생님이 알려주듯 친절하게, 그러나 핵심적인 내용만 콕콕 집어준다. 책의 첫 페이지를 펼쳐서 마지막 페이지를 덮을 때까지, 혼자서도 충분히 파이썬을 배울 수 있다는 자신감과 확신이 계속될 것이다!"
"이천 년의 공부";"";"조윤제";951827;"위즈덤하우스";"2019.05.31";"이상없음";0;"대출 가능";0;"";14400;308;"";"그는 마음의 주인으로 살기 위해 노력했고, 말을 통해 사람을 아는 능력을 길렀다. 이러한 노력은 결국 그를 공자 다음가는 성인이라는 의미의 아성(亞聖)으로 불리게 했다. 이 책은 맹자가 혼란의 시대를 무사히 돌파한 힘을 살펴보고, 그로부터 무례함이 난무하는 오늘날 스스로를 지키는 법을 배운다."
"사라진 암";"";"한상도";955210;"사이몬북스";"2021.10.25";"이상없음";0;"대출 가능";0;"";14400;272;"";"이 책은 암을 선고받은 한 남자가 병원과 의사에게 의지하지 않고 스스로 자연치유하는 과정을 엮은 책이다. 그는 수많은 건강관련 책들을 독파한 결과, 암은 나쁜 음식과 나쁜 습관의 결과라는 사실을 깨달았다. 그는 수술과 약물을 택하지 않고 음식을 바꾸었다."
"백년운동";"";"정선근";957201;"아티잔";"2019.10.31";"이상없음";0;"대출 가능";0;"";17550;484;"";"서울대 의대 재활의학과 정선근 교수는 그의 새로운 책, ‘백년운동’을 통해서 100세 인생을 건강하고 멋지게 살고 싶은 이들에게 그 방법을 의학적으로 제시하고 있다. 정 교수가 몇 년 전에 출간한, 건강분야의 스테디셀러인 ‘ 백년허리’ , ‘백년 목’이 허리와 목디스크 질환에 대한 새로운 치료법을 대중에게 제시한 책이라면, 이번 신간인 ‘백년운동’은 관절과 척추를 보호하면서 안전하게 운동할 수 있는 운동방법을 제시한 책이다."
"백년허리";"";"정선근";985102;"언탱글링";"2021.05.13";"이상없음";0;"대출 가능";0;"";16600;304;"";"치료편에서 저자는 허리 통증에서 벗어날 수 있는 방법을 정확히, 구체적으로, 누구나 따라할 수 있도록 설명하고 있다. 일상생활, 운동, 작업 등 허리 아픈 사람이 겪게 되는 모든 상황에서 허리를 어떻게 사용하는 것이 옳은지를 알려주는 말그대로 국민 허리 사용설명서이다."
"리더는 하루에 백 번 싸운다";"";"조우성";987456;"인플루엔셜";"2019.08.28";"이상없음";0;"대출 가능";0;"";14200;300;"";"어떤 위기가 와도 흔들리지 않는 단단한 내공을 쌓기 위해서는 오랜 시간을 견디며 스스로 가치를 증명한 고전으로 돌아가야 한다고 조언하며 일과 삶에서 모두 최고의 리더가 되고 싶은 이들에게 길잡이가 되어준다."
"클린 아키텍처";"";"톰 홈버그";998856;"위키북스";"2021.11.26";"이상없음";0;"대출 가능";0;"";16200;168;"";"실제 코드에서 어떻게 육각형 아키텍처를 구현하는지를 보여주기 위한 실습 단원으로 넘어가, 실습을 통해 육각형 아키텍처의 다양한 계층 간 매핑 전략들을 자세히 알아보고 아키텍처의 요소들을 어떻게 애플리케이션에 녹여낼 것인지 배운다. 이어지는 몇 개의 장에서는 아키텍처 경계를 강제하는 방법에 관해 살펴본다"
